{
  "generated": "2026-10-14",
  "root": "social/actor/public/polity",
  "count": 146,
  "codes": {
    "are": {
      "name": "United Arab Emirates",
      "native": "UAE / Al-Imārāt",
      "flag": "🇦🇪",
      "has_node": true,
      "counts": {
        "explanation": 1,
        "representation": 1
      },
      "works": [
        {
          "id": "actor",
          "type": "Temporal",
          "status": "active",
          "title": "🇦🇪 Actor Space",
          "link": "actor.html"
        },
        {
          "id": "united-arab-emirates-uae",
          "type": "note",
          "status": "active",
          "title": "🇦🇪 United Arab Emirates (UAE)",
          "link": "../../../../../../web/note.html?n=social/actor/public/polity/are/united-arab-emirates-uae.md"
        }
      ],
      "notes": [
        {
          "path": "social/actor/public/polity/are/united-arab-emirates-uae.md",
          "title": "🇦🇪 United Arab Emirates (UAE)",
          "kind": "explanation"
        },
        {
          "path": "social/actor/public/polity/are/actor.html",
          "title": "🇦🇪 Actor Space",
          "kind": "representation"
        }
      ]
    },
    "arg": {
      "name": "Argentina",
      "native": "República Argentina",
      "flag": "🇦🇷",
      "has_node": true,
      "counts": {
        "explanation": 1,
        "representation": 1
      },
      "works": [
        {
          "id": "actor",
          "type": "Temporal",
          "status": "active",
          "title": "🇦🇷 Actor Space",
          "link": "actor.html"
        },
        {
          "id": "argentina",
          "type": "note",
          "status": "active",
          "title": "Argentina",
          "link": "../../../../../../web/note.html?n=social/actor/public/polity/arg/argentina.md"
        }
      ],
      "notes": [
        {
          "path": "social/actor/public/polity/arg/argentina.md",
          "title": "Argentina",
          "kind": "explanation"
        },
        {
          "path": "social/actor/public/polity/arg/actor.html",
          "title": "🇦🇷 Actor Space",
          "kind": "representation"
        }
      ]
    },
    "aus": {
      "name": "Australia",
      "native": "Australia",
      "flag": "🇦🇺",
      "has_node": true,
      "counts": {
        "explanation": 1,
        "representation": 1
      },
      "works": [
        {
          "id": "actor",
          "type": "Temporal",
          "status": "active",
          "title": "🇦🇺 Actor Space",
          "link": "actor.html"
        },
        {
          "id": "australia",
          "type": "note",
          "status": "active",
          "title": "Australia",
          "link": "../../../../../../web/note.html?n=social/actor/public/polity/aus/australia.md"
        }
      ],
      "notes": [
        {
          "path": "social/actor/public/polity/aus/australia.md",
          "title": "Australia",
          "kind": "explanation"
        },
        {
          "path": "social/actor/public/polity/aus/actor.html",
          "title": "🇦🇺 Actor Space",
          "kind": "representation"
        }
      ]
    },
    "aut": {
      "name": "Austria",
      "native": "",
      "flag": "🏳️",
      "has_node": false,
      "counts": {
        "explanation": 1,
        "representation": 0
      },
      "works": [
        {
          "id": "austria",
          "type": "note",
          "status": "active",
          "title": "Austria",
          "link": "../../../../../../web/note.html?n=social/actor/public/polity/aut/austria.md"
        }
      ],
      "notes": [
        {
          "path": "social/actor/public/polity/aut/austria.md",
          "title": "Austria",
          "kind": "explanation"
        }
      ]
    },
    "bel": {
      "name": "Belgium",
      "native": "",
      "flag": "🏳️",
      "has_node": false,
      "counts": {
        "explanation": 2,
        "representation": 0
      },
      "works": [
        {
          "id": "belgium",
          "type": "note",
          "status": "active",
          "title": "Belgium",
          "link": "../../../../../../web/note.html?n=social/actor/public/polity/bel/belgium.md"
        },
        {
          "id": "flanders",
          "type": "note",
          "status": "active",
          "title": "Flanders",
          "link": "../../../../../../web/note.html?n=social/actor/public/polity/bel/region/flanders.md"
        }
      ],
      "notes": [
        {
          "path": "social/actor/public/polity/bel/belgium.md",
          "title": "Belgium",
          "kind": "explanation"
        },
        {
          "path": "social/actor/public/polity/bel/region/flanders.md",
          "title": "Flanders",
          "kind": "explanation"
        }
      ]
    },
    "bhr": {
      "name": "Bahrain",
      "native": "",
      "flag": "🏳️",
      "has_node": false,
      "counts": {
        "explanation": 1,
        "representation": 0
      },
      "works": [
        {
          "id": "bahrain",
          "type": "note",
          "status": "active",
          "title": "Bahrain",
          "link": "../../../../../../web/note.html?n=social/actor/public/polity/bhr/bahrain.md"
        }
      ],
      "notes": [
        {
          "path": "social/actor/public/polity/bhr/bahrain.md",
          "title": "Bahrain",
          "kind": "explanation"
        }
      ]
    },
    "bol": {
      "name": "Bolivia",
      "native": "",
      "flag": "🏳️",
      "has_node": false,
      "counts": {
        "explanation": 1,
        "representation": 0
      },
      "works": [
        {
          "id": "bolivia",
          "type": "note",
          "status": "active",
          "title": "Bolivia",
          "link": "../../../../../../web/note.html?n=social/actor/public/polity/bol/bolivia.md"
        }
      ],
      "notes": [
        {
          "path": "social/actor/public/polity/bol/bolivia.md",
          "title": "Bolivia",
          "kind": "explanation"
        }
      ]
    },
    "bra": {
      "name": "Brazil",
      "native": "República Federativa do Brasil",
      "flag": "🇧🇷",
      "has_node": true,
      "counts": {
        "explanation": 1,
        "representation": 1
      },
      "works": [
        {
          "id": "actor",
          "type": "Temporal",
          "status": "active",
          "title": "🇧🇷 Actor Space",
          "link": "actor.html"
        },
        {
          "id": "brazil",
          "type": "note",
          "status": "active",
          "title": "Brazil",
          "link": "../../../../../../web/note.html?n=social/actor/public/polity/bra/brazil.md"
        }
      ],
      "notes": [
        {
          "path": "social/actor/public/polity/bra/brazil.md",
          "title": "Brazil",
          "kind": "explanation"
        },
        {
          "path": "social/actor/public/polity/bra/actor.html",
          "title": "🇧🇷 Actor Space",
          "kind": "representation"
        }
      ]
    },
    "bwa": {
      "name": "Botswana",
      "native": "",
      "flag": "🏳️",
      "has_node": false,
      "counts": {
        "explanation": 1,
        "representation": 0
      },
      "works": [
        {
          "id": "botswana",
          "type": "note",
          "status": "active",
          "title": "Botswana",
          "link": "../../../../../../web/note.html?n=social/actor/public/polity/bwa/botswana.md"
        }
      ],
      "notes": [
        {
          "path": "social/actor/public/polity/bwa/botswana.md",
          "title": "Botswana",
          "kind": "explanation"
        }
      ]
    },
    "can": {
      "name": "Canada",
      "native": "Canada",
      "flag": "🇨🇦",
      "has_node": true,
      "counts": {
        "explanation": 1,
        "representation": 1
      },
      "works": [
        {
          "id": "actor",
          "type": "Temporal",
          "status": "active",
          "title": "🇨🇦 Actor Space",
          "link": "actor.html"
        },
        {
          "id": "canada",
          "type": "note",
          "status": "active",
          "title": "Canada",
          "link": "../../../../../../web/note.html?n=social/actor/public/polity/can/canada.md"
        }
      ],
      "notes": [
        {
          "path": "social/actor/public/polity/can/canada.md",
          "title": "Canada",
          "kind": "explanation"
        },
        {
          "path": "social/actor/public/polity/can/actor.html",
          "title": "🇨🇦 Actor Space",
          "kind": "representation"
        }
      ]
    },
    "che": {
      "name": "Switzerland",
      "native": "Schweiz / Suisse / Svizzera",
      "flag": "🇨🇭",
      "has_node": true,
      "counts": {
        "explanation": 2,
        "representation": 1
      },
      "works": [
        {
          "id": "actor",
          "type": "Temporal",
          "status": "active",
          "title": "🇨🇭 Actor Space",
          "link": "actor.html"
        },
        {
          "id": "state",
          "type": "note",
          "status": "active",
          "title": "Case Study: Switzerland’s Government and Institutional Architecture",
          "link": "../../../../../../web/note.html?n=social/actor/public/polity/che/state.md"
        },
        {
          "id": "switzerland",
          "type": "note",
          "status": "active",
          "title": "Switzerland",
          "link": "../../../../../../web/note.html?n=social/actor/public/polity/che/switzerland.md"
        }
      ],
      "notes": [
        {
          "path": "social/actor/public/polity/che/state.md",
          "title": "Case Study: Switzerland’s Government and Institutional Architecture",
          "kind": "explanation"
        },
        {
          "path": "social/actor/public/polity/che/switzerland.md",
          "title": "Switzerland",
          "kind": "explanation"
        },
        {
          "path": "social/actor/public/polity/che/actor.html",
          "title": "🇨🇭 Actor Space",
          "kind": "representation"
        }
      ]
    },